Property Name,Data Type,Description
allowPastAllocationTimesForCurrentDayFor,LIST,Allows admins to allocate desks/slots/rooms for past shift times on the same day.
bannerStartTime,STRING,-
promotionBannerUrl,STRING,-
employeePIIMasking,LIST,Configures selective masking of PII fields and visual security settings.
tagsEnabled,LIST,Defines enabled booking tags.
bannerEndTime,STRING,-
isDelegationEnabled,BOOLEAN,Master switch enabling Delegation feature.
industryStandard,JSON,Controls industry standard values on Admin Dashboard metric cards.
enableDelegationForAdmins,BOOLEAN,Allows admins to manage delegation.
nativeRoomEmail,BOOLEAN,Displays room email ID input in new room workflow.
bannerNativeRoomEmail,BOOLEAN,Controls native banner visibility in room emails.
allowedEmployeeNameRegex,STRING,Defines the allowed employee name format using regex validation.
meetingDetailsForDateUrl,STRING,Defines Meeting Details by date URL.
Floorplan_Legend_Employee_Web_Expanded,BOOLEAN,Controls expanded or collapsed legend state on employee web floor plan.
MOBILE_APP_BANNERS,LIST,-
delegatorDelegateeEmailsEnabled,BOOLEAN,Sends email notification to delegator.
enableMealImageIn,LIST,To show meal image in meal item.
SEAT_BELT_NON_COMPLIANCE_REPORT_EMAIL_ENABLED,BOOLEAN,-
enableQRBasedSignOutButton,BOOLEAN,Enables QR-based sign-out.
showEmployeeCreation,BOOLEAN,-
showConfigureDeskAmenities,BOOLEAN,Controls visibility of desk amenities configuration button.
enableQRBasedRemoteSignin,BOOLEAN,Enables QR-based remote sign-in.
mealFeedbackOptions,JSON,Configures meal feedback options.
remoteSignOutCutoffInMinute,INTEGER,Defines cutoff time for remote sign-out.
maximumCharacterLimit,DOUBLE,-
editProfileEnabled,BOOLEAN,Controls profile editing.
ENABLE_INDOOR_NAVIGATION,BOOLEAN,Enables wayfinding/navigation to desks.
isEmployeeCreationEnabledForMSu,BOOLEAN,Controls MSU employee creation feature.
allowBookingWithDedicatedSeat,LIST,Controls whether dedicated seat holders can book other desks.
notificationOnDeskRelease,BOOLEAN,Controls desk release notifications.
isEmloyeeCreationForMsuEnabled,BOOLEAN,Controls MSU employee creation.
pinDisanceThresholdForShuttleStopApi,DOUBLE,-
mappedShuttleRouteBufferInMinutes,DOUBLE,-
nearByShuttleStopDistanceInMetre,DOUBLE,-
blockChecinOutsideGeofence,BOOLEAN,-
workplannerCheckInDelayCutOffInMinute,INTEGER,Defines late check-in limit for Workplanner bookings.
genericLabelForDesk,STRING,-
enableParkingCheckOutWithOfficeCheckOut,BOOLEAN,Links parking checkout with office checkout.
Premise_Floorplan_Legend_Collapsed,BOOLEAN,Collapses the legend by default on the Premises floor plan view.
crossHierarchyAllocationEnabled,BOOLEAN,Defines if cross hierarchy allocation is allowed for RBAC enabled sites.
listOfEligibleBuidsForAutoClockout,LIST,Defines BUs eligible for auto clock-out.
excludeMealOnlyBookingsFromActiveBookingCount,BOOLEAN,Decides whether to exclude meal booking from web/app/bulk from active booking count for any user.
searchCriteriaVendorKiosk,JSON,Used to control search section and placeholder for vendor kiosk and dashboard search.
mealNotifications,BOOLEAN,Enable e-mails related to meal bookings for QR.
enableMultiMealSelect,BOOLEAN,Enables multi selection on meal booking.
SEAT_BELT_NON_COMPLIANCE_EMAIL_CONFIGS,JSON,-
runTransportOptOutJob,BOOLEAN,Auto rejection/approval + schedule deletion for opted out users.
liveSupportChatFeatureEnabled,BOOLEAN,-
enableSuppportRequest,BOOLEAN,-
optOutPendingEmailSubject,STRING,-
workplannerCheckInAdvanceCutOffInMinute,INTEGER,Defines early check-in limit for Workplanner bookings.
ACCESS_MATRIX_ENABLED_BUIDS,LIST,Defines BUs with access matrix enabled.
isWelcomeEmailEnabled,BOOLEAN,-
enableNewAllocationFlow,BOOLEAN,Enables new allocation flow required for time-based allocation.
enableStandardMealSelectionFlow,BOOLEAN,Enables standard meal booking flow and overrides both normal chip and cart view.
checkInByTimeChip,BOOLEAN,True - Show the check-in-by chip and chevron to provide users with detailed check-in times. False - Do not show the check-in-by chip or the chevron on booking cards.
mealOnlyBulkBookingOptionalHeaders,LIST,Optional headers.
